Alias,Alias_normalizado
WILLIAMS SAMUEL PEREZ PIEDRA,WILLIAMS SAMUEL PEREZ PIEDRA
WILLIAMS SAMUEL PEREZ PIEDRA,WILLIAMS SAMUEL PEREZ PIEDRA
JOSE ERNESTO SOLER LLUIS,JOSE ERNESTO SOLER LLUIS
ADVISING & COUNSELING SERVICES LLC,ADVISING & COUNSELING SERVICES LLC
SARA ELENA JARRIN VALAREZO,SARA ELENA JARRIN VALAREZO
"PGS CONSULTING GROUP, LTD.","PGS CONSULTING GROUP, LTD."
GALO FERNANDO LARREA VASCONEZ,GALO FERNANDO LARREA VASCONEZ
LEONARDO SEBASTIAN PULLAS BASTIDAS,LEONARDO SEBASTIAN PULLAS BASTIDAS
MARGARITA ILLESCAS,MARGARITA ILLESCAS
GABRIELA LESLIE VELEZ PEREIRA,GABRIELA LESLIE VELEZ PEREIRA
TITO LIVIO MUJICA SPECIALE,TITO LIVIO MUJICA SPECIALE
SARA ESTHER PEÑA ALARCON,SARA ESTHER PENA ALARCON
MARIA FERNANDA CALDERON ESTRADA,MARIA FERNANDA CALDERON ESTRADA
KAREN PAOLA RAMIREZ PEDRERA,KAREN PAOLA RAMIREZ PEDRERA
PABLO ESTEBAN LUCERO VILLARREAL,PABLO ESTEBAN LUCERO VILLARREAL
PEDRO PABLO FUENZALIDA URZUA,PEDRO PABLO FUENZALIDA URZUA
SANTIAGO DAVID LEIVA BRITEZ,SANTIAGO DAVID LEIVA BRITEZ
